{
    "schemaVersion":  "1.0",
    "caseId":  "AUTH-001-01",
    "executedAtUtc":  "2026-07-19T19:46:08.2242393+00:00",
    "result":  "PASS",
    "browserChannel":  "msedge",
    "serverMode":  "next-start-optimized",
    "buildIdentity":  {
                          "commit":  "9f9ca023552ed2d0a807a1119ac7c2e8ba20c916",
                          "sourceTreeSha256":  "7ebd65c9841c45f55d747e7e4694ecb896a046d36f05830639d844d4de4ea1af",
                          "nextBuildId":  "Pz7dP9KLBo_cwPoXVUmGl"
                      },
    "lanes":  [
                  {
                      "schemaVersion":  "1.0",
                      "caseId":  "AUTH-001-01",
                      "lane":  "HTTP",
                      "executedAtUtc":  "2026-07-19T19:46:01.581Z",
                      "baseOrigin":  "http://127.0.0.1:3101",
                      "browserChannel":  "msedge",
                      "serverMode":  "next-start-optimized",
                      "buildIdentity":  {
                                            "commit":  "9f9ca023552ed2d0a807a1119ac7c2e8ba20c916",
                                            "sourceTreeSha256":  "7ebd65c9841c45f55d747e7e4694ecb896a046d36f05830639d844d4de4ea1af",
                                            "nextBuildId":  "Pz7dP9KLBo_cwPoXVUmGl"
                                        },
                      "protectedRouteRedirected":  true,
                      "returnedToRequestedRoute":  true,
                      "responseBodyInspection":  {
                                                     "inspectedCount":  57,
                                                     "unreadableCount":  0,
                                                     "boundedCaptureExceeded":  false,
                                                     "actualUsernameChecked":  true,
                                                     "expectedPrincipalUsernameObserved":  true,
                                                     "unexpectedUsernameExposureDetected":  false,
                                                     "actualPasswordChecked":  true,
                                                     "passwordExposureDetected":  false,
                                                     "actualSessionCookieChecked":  true,
                                                     "sessionCookieExposureDetected":  false
                                                 },
                      "browserExposure":  {
                                              "inspectedUrlCount":  221,
                                              "inspectedConsoleMessageCount":  1,
                                              "inspectedStorageEntryCount":  3,
                                              "actualUsernameChecked":  true,
                                              "actualPasswordChecked":  true,
                                              "actualSessionCookieChecked":  true,
                                              "urlExposureDetected":  false,
                                              "storageSensitiveKeyDetected":  false,
                                              "storageValueExposureDetected":  false,
                                              "consoleExposureDetected":  false
                                          },
                      "sessionCookie":  {
                                            "present":  true,
                                            "httpOnly":  true,
                                            "secureMatchesLane":  true,
                                            "pathIsRoot":  true,
                                            "sameSiteIsLax":  true,
                                            "positiveFiniteLifetime":  true
                                        },
                      "retainedEvidenceSecretScan":  {
                                                         "actualUsernameChecked":  true,
                                                         "actualPasswordChecked":  true,
                                                         "actualSessionCookieChecked":  true,
                                                         "exposureDetected":  false
                                                     },
                      "networkEvents":  [
                                            {
                                                "method":  "GET",
                                                "path":  "/datascope",
                                                "status":  200,
                                                "lane":  "HTTP",
                                                "buildIdentity":  "9f9ca023552ed2d0a807a1119ac7c2e8ba20c916:7ebd65c9841c45f55d747e7e4694ecb896a046d36f05830639d844d4de4ea1af:Pz7dP9KLBo_cwPoXVUmGl"
                                            },
                                            {
                                                "method":  "GET",
                                                "path":  "/_next/static/chunks/1z_lg8_5mlut1.css",
                                                "status":  200,
                                                "lane":  "HTTP",
                                                "buildIdentity":  "9f9ca023552ed2d0a807a1119ac7c2e8ba20c916:7ebd65c9841c45f55d747e7e4694ecb896a046d36f05830639d844d4de4ea1af:Pz7dP9KLBo_cwPoXVUmGl"
                                            },
                                            {
                                                "method":  "GET",
                                                "path":  "/_next/static/chunks/2od4o208dj0j3.css",
                                                "status":  200,
                                                "lane":  "HTTP",
                                                "buildIdentity":  "9f9ca023552ed2d0a807a1119ac7c2e8ba20c916:7ebd65c9841c45f55d747e7e4694ecb896a046d36f05830639d844d4de4ea1af:Pz7dP9KLBo_cwPoXVUmGl"
                                            },
                                            {
                                                "method":  "GET",
                                                "path":  "/_next/static/chunks/2_f7onw_b1cqk.css",
                                                "status":  200,
                                                "lane":  "HTTP",
                                                "buildIdentity":  "9f9ca023552ed2d0a807a1119ac7c2e8ba20c916:7ebd65c9841c45f55d747e7e4694ecb896a046d36f05830639d844d4de4ea1af:Pz7dP9KLBo_cwPoXVUmGl"
                                            },
                                            {
                                                "method":  "GET",
                                                "path":  "/_next/static/chunks/39fgd6pk3g6t8.css",
                                                "status":  200,
                                                "lane":  "HTTP",
                                                "buildIdentity":  "9f9ca023552ed2d0a807a1119ac7c2e8ba20c916:7ebd65c9841c45f55d747e7e4694ecb896a046d36f05830639d844d4de4ea1af:Pz7dP9KLBo_cwPoXVUmGl"
                                            },
                                            {
                                                "method":  "GET",
                                                "path":  "/_next/static/media/70bc3e132a0a741e-s.p.3t6q91iet4nsy.woff2",
                                                "status":  200,
                                                "lane":  "HTTP",
                                                "buildIdentity":  "9f9ca023552ed2d0a807a1119ac7c2e8ba20c916:7ebd65c9841c45f55d747e7e4694ecb896a046d36f05830639d844d4de4ea1af:Pz7dP9KLBo_cwPoXVUmGl"
                                            },
                                            {
                                                "method":  "GET",
                                                "path":  "/_next/static/chunks/2zjueh7t2vecu.js",
                                                "status":  200,
                                                "lane":  "HTTP",
                                                "buildIdentity":  "9f9ca023552ed2d0a807a1119ac7c2e8ba20c916:7ebd65c9841c45f55d747e7e4694ecb896a046d36f05830639d844d4de4ea1af:Pz7dP9KLBo_cwPoXVUmGl"
                                            },
                                            {
                                                "method":  "GET",
                                                "path":  "/_next/static/chunks/2a6u__jnmx9y3.js",
                                                "status":  200,
                                                "lane":  "HTTP",
                                                "buildIdentity":  "9f9ca023552ed2d0a807a1119ac7c2e8ba20c916:7ebd65c9841c45f55d747e7e4694ecb896a046d36f05830639d844d4de4ea1af:Pz7dP9KLBo_cwPoXVUmGl"
                                            },
                                            {
                                                "method":  "GET",
                                                "path":  "/_next/static/chunks/0n-zjr76qg7uq.js",
                                                "status":  200,
                                                "lane":  "HTTP",
                                                "buildIdentity":  "9f9ca023552ed2d0a807a1119ac7c2e8ba20c916:7ebd65c9841c45f55d747e7e4694ecb896a046d36f05830639d844d4de4ea1af:Pz7dP9KLBo_cwPoXVUmGl"
                                            },
                                            {
                                                "method":  "GET",
                                                "path":  "/_next/static/media/83afe278b6a6bb3c-s.p.2bn3s6zvc0dyp.woff2",
                                                "status":  200,
                                                "lane":  "HTTP",